cbs_overall_draft_position,player,position,cbs_avg_draft_position,cbs_position_draft_position8,"Drew Brees, QB, NO",qb,9.42,112,"Aaron Rodgers, QB, GB",qb,11.25,215,"Peyton Manning, QB, DEN",qb,17,327,"Tom Brady, QB, NE",qb,29.28,432,"Matt Ryan, QB, ATL",qb,34.23,533,"Cam Newton, QB, CAR",qb,35.55,642,"Matthew Stafford, QB, DET",qb,43.1,751,"Andrew Luck, QB, IND",qb,56.85,852,"Colin Kaepernick, QB, SF",qb,56.95,954,"Robert Griffin III, QB, WAS",qb,58.26,1059,"Tony Romo, QB, DAL",qb,62.88,1172,"Russell Wilson, QB, SEA",qb,71.5,1284,"Eli Manning, QB, NYG",qb,84.98,13103,"Andy Dalton, QB, CIN",qb,104.65,14113,"Michael Vick, QB, PHI",qb,117.21,15115,"Jay Cutler, QB, CHI",qb,119.54,16121,"Carson Palmer, QB, ARI",qb,123.53,17125,"Matt Schaub, QB, HOU",qb,125.38,18130,"Ben Roethlisberger, QB, PIT",qb,126.51,19132,"Sam Bradford, QB, STL",qb,127.81,20135,"Josh Freeman, QB, TB",qb,128.78,21136,"Joe Flacco, QB, BAL",qb,129.23,22152,"Alex Smith, QB, KC",qb,138.31,23154,"Philip Rivers, QB, SD",qb,139.06,24168,"Ryan Tannehill, QB, MIA",qb,147.64,25177,"Brandon Weeden, QB, CLE",qb,150.3,26187,"EJ Manuel, QB, BUF",qb,153.8,27197,"Jake Locker, QB, TEN",qb,158.11,28201,"Christian Ponder, QB, MIN",qb,160.02,291,"Adrian Peterson, RB, MIN",rb,1.11,12,"Doug Martin, RB, TB",rb,4.61,23,"Arian Foster, RB, HOU",rb,5.21,34,"Jamaal Charles, RB, KC",rb,5.95,45,"C.J. Spiller, RB, BUF",rb,6.66,56,"Marshawn Lynch, RB, SEA",rb,7.93,67,"Ray Rice, RB, BAL",rb,9.31,710,"Trent Richardson, RB, CLE",rb,9.47,811,"LeSean McCoy, RB, PHI",rb,9.89,913,"Alfred Morris, RB, WAS",rb,14.16,1014,"Matt Forte, RB, CHI",rb,15.6,1116,"Steven Jackson, RB, ATL",rb,19.65,1217,"Chris Johnson, RB, TEN",rb,19.65,1321,"Stevan Ridley, RB, NE",rb,23.75,1424,"Reggie Bush, RB, DET",rb,24.92,1525,"Maurice Jones-Drew, RB, JAC",rb,25.03,1628,"DeMarco Murray, RB, DAL",rb,29.54,1730,"Frank Gore, RB, SF",rb,31.75,1837,"Darren McFadden, RB, OAK",rb,39.74,1939,"David Wilson, RB, NYG",rb,41.93,2041,"Darren Sproles, RB, NO",rb,42.66,2143,"Lamar Miller, RB, MIA",rb,43.28,2257,"Montee Ball, RB, DEN",rb,58.69,2358,"Eddie Lacy, RB, GB",rb,62.43,2461,"Giovani Bernard, RB, CIN",rb,63.8,2562,"Ryan Mathews, RB, SD",rb,64.32,2664,"Le'Veon Bell, RB, PIT",rb,65.96,2770,"Rashard Mendenhall, RB, ARI",rb,70.25,2871,"Shane Vereen, RB, NE",rb,70.93,2974,"Ahmad Bradshaw, RB, IND",rb,74.04,3075,"Chris Ivory, RB, NYJ",rb,75.05,3180,"Daryl Richardson, RB, STL",rb,79.71,3285,"Andre Brown, RB, NYG",rb,88.99,3389,"DeAngelo Williams, RB, CAR",rb,94.15,3495,"BenJarvus Green-Ellis, RB, CIN",rb,96.84,3596,"Mark Ingram, RB, NO",rb,98.05,3699,"Ben Tate, RB, HOU",rb,102.54,37101,"Ronnie Hillman, RB, DEN",rb,104.15,38117,"Fred Jackson, RB, BUF",rb,122.38,39119,"Jonathan Stewart, RB, CAR",rb,123.22,40120,"Vick Ballard, RB, IND",rb,123.3,41123,"Bernard Pierce, RB, BAL",rb,124.42,42124,"Danny Woodhead, RB, SD",rb,125.34,43127,"Pierre Thomas, RB, NO",rb,125.79,44129,"Bryce Brown, RB, PHI",rb,126.42,45145,"Zac Stacy, RB, STL",rb,135,46153,"Jonathan Dwyer, RB, PIT",rb,138.57,47155,"Jacquizz Rodgers, RB, ATL",rb,139.5,48156,"Johnathan Franklin, RB, GB",rb,139.88,49160,"Shonn Greene, RB, TEN",rb,142.14,50161,"Bilal Powell, RB, NYJ",rb,142.19,51162,"Mikel Leshoure, RB, DET",rb,143.45,52169,"Michael Bush, RB, CHI",rb,147.93,53170,"Isaiah Pead, RB, STL",rb,148.12,54173,"Daniel Thomas, RB, MIA",rb,148.7,55189,"LaMichael James, RB, SF",rb,154.84,56190,"Knile Davis, RB, KC",rb,155.11,57192,"Joseph Randle, RB, DAL",rb,156.16,58193,"Joique Bell, RB, DET",rb,156.18,59194,"Roy Helu, RB, WAS",rb,157.17,60196,"DuJuan Harris, RB, GB",rb,158,61199,"LeGarrette Blount, RB, NE",rb,159.74,62205,"Knowshon Moreno, RB, DEN",rb,161.74,63210,"Toby Gerhart, RB, MIN",rb,162.49,64211,"Kendall Hunter, RB, SF",rb,162.86,65212,"Marcel Reece, RB, OAK",rb,163.22,66218,"Robert Turbin, RB, SEA",rb,165.03,67219,"LaRod Stephens-Howling, RB, PIT",rb,165.12,68225,"Denard Robinson, RB, JAC",rb,166.87,69238,"Mike Tolbert, RB, CAR",rb,176.71,709,"Calvin Johnson, WR, DET",wr,9.46,118,"Dez Bryant, WR, DAL",wr,19.68,219,"A.J. Green, WR, CIN",wr,20.15,320,"Brandon Marshall, WR, CHI",wr,23.12,423,"Julio Jones, WR, ATL",wr,23.91,526,"Demaryius Thomas, WR, DEN",wr,27.82,629,"Larry Fitzgerald, WR, ARI",wr,30.05,731,"Andre Johnson, WR, HOU",wr,32.45,834,"Roddy White, WR, ATL",wr,35.86,935,"Randall Cobb, WR, GB",wr,36.68,1036,"Victor Cruz, WR, NYG",wr,38.23,1138,"Vincent Jackson, WR, TB",wr,40.93,1240,"Wes Welker, WR, DEN",wr,42.53,1345,"Dwayne Bowe, WR, KC",wr,48.08,1446,"Marques Colston, WR, NO",wr,48.77,1547,"Danny Amendola, WR, NE",wr,49.35,1648,"Reggie Wayne, WR, IND",wr,51.18,1750,"Pierre Garcon, WR, WAS",wr,55.04,1855,"Eric Decker, WR, DEN",wr,58.61,1960,"Hakeem Nicks, WR, NYG",wr,63.19,2063,"Steve Smith, WR, CAR",wr,64.72,2165,"Torrey Smith, WR, BAL",wr,66.32,2266,"Antonio Brown, WR, PIT",wr,67.9,2367,"James Jones, WR, GB",wr,68.94,2468,"Jordy Nelson, WR, GB",wr,69.81,2569,"DeSean Jackson, WR, PHI",wr,70.01,2676,"Mike Wallace, WR, MIA",wr,75.29,2777,"Tavon Austin, WR, STL",wr,78.65,2879,"T.Y. Hilton, WR, IND",wr,78.78,2982,"Cecil Shorts, WR, JAC",wr,82.88,3086,"Steve Johnson, WR, BUF",wr,89.64,3190,"Anquan Boldin, WR, SF",wr,94.4,3291,"Mike Williams, WR, TB",wr,95.46,3393,"Greg Jennings, WR, MIN",wr,95.71,3494,"Miles Austin, WR, DAL",wr,96.11,3598,"Kenny Britt, WR, TEN",wr,100.72,36102,"Danario Alexander, WR, SD",wr,104.55,37104,"Golden Tate, WR, SEA",wr,106.88,38105,"Lance Moore, WR, NO",wr,107.63,39108,"Josh Gordon, WR, CLE",wr,110.16,40111,"Chris Givens, WR, STL",wr,113.76,41114,"Michael Floyd, WR, ARI",wr,117.31,42122,"Percy Harvin, WR, SEA",wr,123.65,43126,"Emmanuel Sanders, WR, PIT",wr,125.43,44128,"DeAndre Hopkins, WR, HOU",wr,126.09,45133,"Denarius Moore, WR, OAK",wr,127.97,46138,"Vincent Brown, WR, SD",wr,130.07,47142,"Sidney Rice, WR, SEA",wr,133.14,48143,"Justin Blackmon, WR, JAC",wr,133.56,49146,"Kenbrell Thompkins, WR, NE",wr,135.07,50147,"Ryan Broyles, WR, DET",wr,136.97,51151,"Alshon Jeffery, WR, CHI",wr,138.01,52158,"Rueben Randle, WR, NYG",wr,141.71,53163,"Cordarrelle Patterson, WR, MIN",wr,144.26,54165,"Aaron Dobson, WR, NE",wr,144.61,55171,"Brian Hartline, WR, MIA",wr,148.21,56172,"Darrius Heyward-Bey, WR, IND",wr,148.48,57181,"Brandon LaFell, WR, CAR",wr,152.67,58183,"Kendall Wright, WR, TEN",wr,153,59185,"Malcom Floyd, WR, SD",wr,153.45,60186,"Mohamed Sanu, WR, CIN",wr,153.66,61191,"Jacoby Jones, WR, BAL",wr,156.12,62203,"Santonio Holmes, WR, NYJ",wr,161.12,63204,"Greg Little, WR, CLE",wr,161.24,64215,"Robert Woods, WR, BUF",wr,163.94,65217,"Rod Streater, WR, OAK",wr,164.95,66220,"Santana Moss, WR, WAS",wr,165.19,67224,"Andre Roberts, WR, ARI",wr,166.86,68233,"Nate Burleson, WR, DET",wr,169.09,6922,"Jimmy Graham, TE, NO",te,23.75,144,"Rob Gronkowski, TE, NE",te,47.52,249,"Jason Witten, TE, DAL",te,52.91,353,"Vernon Davis, TE, SF",te,57.8,456,"Tony Gonzalez, TE, ATL",te,58.63,578,"Antonio Gates, TE, SD",te,78.7,681,"Jermichael Finley, TE, GB",te,82.13,788,"Kyle Rudolph, TE, MIN",te,92.88,892,"Jared Cook, TE, STL",te,95.59,997,"Greg Olsen, TE, CAR",te,98.65,10110,"Owen Daniels, TE, HOU",te,112.15,11112,"Martellus Bennett, TE, CHI",te,116.59,12116,"Jordan Cameron, TE, CLE",te,120.34,13131,"Brandon Myers, TE, NYG",te,127.13,14137,"Brandon Pettigrew, TE, DET",te,129.54,15148,"Tyler Eifert, TE, CIN",te,137.04,16157,"Fred Davis, TE, WAS",te,141.4,17166,"Zach Sudfeld, TE, NE",te,145.46,18178,"Coby Fleener, TE, IND",te,150.31,19180,"Jermaine Gresham, TE, CIN",te,151.42,20188,"Dustin Keller, TE, MIA",te,154.23,21198,"Marcedes Lewis, TE, JAC",te,159.67,22207,"Heath Miller, TE, PIT",te,162.26,23214,"Rob Housler, TE, ARI",te,163.92,24221,"Zach Miller, TE, SEA",te,165.6,25222,"Brent Celek, TE, PHI",te,166.33,26226,"Dwayne Allen, TE, IND",te,167.01,27229,"James Casey, TE, PHI",te,167.77,28235,"Ed Dickson, TE, BAL",te,169.83,29107,"Stephen Gostkowski, K, NE",k,109.97,1134,"Matt Bryant, K, ATL",k,128.66,2139,"Phil Dawson, K, SF",k,131.15,3141,"Matt Prater, K, DEN",k,132.65,4150,"Blair Walsh, K, MIN",k,137.89,5164,"Sebastian Janikowski, K, OAK",k,144.59,6176,"Justin Tucker, K, BAL",k,149.6,7179,"Garrett Hartley, K, NO",k,151.28,8200,"David Akers, K, DET",k,160.02,9202,"Dan Bailey, K, DAL",k,160.24,10206,"Greg Zuerlein, K, STL",k,162.13,11208,"Randy Bullock, K, HOU",k,162.4,12213,"Robbie Gould, K, CHI",k,163.43,13216,"Mason Crosby, K, GB",k,164.15,14223,"Adam Vinatieri, K, IND",k,166.44,15227,"Kai Forbath, K, WAS",k,167.49,16231,"Alex Henery, K, PHI",k,169.03,17232,"Steven Hauschka, K, SEA",k,169.06,18234,"Josh Brown, K, NYG",k,169.7,19237,"Mike Nugent, K, CIN",k,173.19,2073," Seahawks, DST, SEA",dst,73.21,183," 49ers, DST, SF",dst,84.12,287," Bears, DST, CHI",dst,90.13,3100," Bengals, DST, CIN",dst,103.79,4106," Broncos, DST, DEN",dst,109.15,5109," Texans, DST, HOU",dst,111,6118," Patriots, DST, NE",dst,123.21,7140," Ravens, DST, BAL",dst,132.29,8144," Falcons, DST, ATL",dst,134.81,9149," Steelers, DST, PIT",dst,137.69,10159," Packers, DST, GB",dst,142.01,11167," Dolphins, DST, MIA",dst,147.49,12174," Giants, DST, NYG",dst,149.16,13175," Rams, DST, STL",dst,149.35,14182," Cardinals, DST, ARI",dst,152.9,15184," Buccaneers, DST, TB",dst,153.13,16195," Cowboys, DST, DAL",dst,157.41,17209," Browns, DST, CLE",dst,162.47,18228," Vikings, DST, MIN",dst,167.51,19230," Chargers, DST, SD",dst,168.75,20236," Chiefs, DST, KC",dst,169.98,21